{
  "schema_version": "1.0",
  "assessment_id": "cdi-1",
  "created_at": "2026-07-25T10:00:00.000Z",
  "assessor": "Jason",
  "participants": [
    "Jason"
  ],
  "dimensions": [
    {
      "id": "provenance-integrity",
      "name": "provenance-integrity",
      "score": 3,
      "level_label": "Documented",
      "evidence": "why"
    },
    {
      "id": "supervisory-clarity",
      "name": "supervisory-clarity",
      "score": 3,
      "level_label": "Documented",
      "evidence": "why"
    },
    {
      "id": "scope-definition",
      "name": "scope-definition",
      "score": 3,
      "level_label": "Documented",
      "evidence": "why"
    },
    {
      "id": "review-substance",
      "name": "review-substance",
      "score": 3,
      "level_label": "Documented",
      "evidence": "why"
    },
    {
      "id": "constraint-fidelity",
      "name": "constraint-fidelity",
      "score": 3,
      "level_label": "Documented",
      "evidence": "why"
    },
    {
      "id": "capability-calibration",
      "name": "capability-calibration",
      "score": 3,
      "level_label": "Documented",
      "evidence": "why"
    }
  ],
  "summary": {
    "average_score": 3,
    "lowest_score": 3,
    "lowest_dimensions": [
      "scope-definition"
    ],
    "profile": "flat"
  },
  "ninety_day_priority": {
    "dimension": "scope-definition",
    "action": "a",
    "success_measure": "m",
    "review_date": "2026-10-01"
  },
  "next_assessment_due": "2026-10-01T00:00:00.000Z",
  "source": {
    "instrument": "Cognitive Delivery Index",
    "version": "1.0"
  }
}
