{
  "schema_version": "1.0",
  "assessment_id": "cdi-2026-07-25T10-00-00-000Z",
  "created_at": "2026-07-25T10:00:00.000Z",
  "assessor": "Jason",
  "participants": [
    "Jason",
    "system"
  ],
  "dimensions": [
    {
      "id": "provenance-integrity",
      "name": "Provenance Integrity",
      "score": 5,
      "level_label": "Substantive",
      "evidence": "All artefacts carry provenance."
    },
    {
      "id": "supervisory-clarity",
      "name": "Supervisory Clarity",
      "score": 4,
      "level_label": "Complete",
      "evidence": "Every task claimed and reviewed."
    },
    {
      "id": "scope-definition",
      "name": "Scope Definition",
      "score": 3,
      "level_label": "Documented",
      "evidence": "Steering complete, scope lists partial."
    },
    {
      "id": "review-substance",
      "name": "Review Substance",
      "score": 4,
      "level_label": "Complete",
      "evidence": "Reviews carry reasoning, not just an outcome."
    },
    {
      "id": "constraint-fidelity",
      "name": "Constraint Fidelity",
      "score": 2,
      "level_label": "Informal",
      "evidence": "Few fields sealed at org level."
    },
    {
      "id": "capability-calibration",
      "name": "Capability Calibration",
      "score": 3,
      "level_label": "Documented",
      "evidence": "Tier 2 matches the evidence."
    }
  ],
  "summary": {
    "average_score": 3.5,
    "lowest_score": 2,
    "lowest_dimensions": [
      "constraint-fidelity"
    ],
    "profile": "brittle"
  },
  "ninety_day_priority": {
    "dimension": "constraint-fidelity",
    "action": "Seal critical config at org level.",
    "success_measure": "Zero break-glass events over the quarter.",
    "review_date": "2026-10-23"
  },
  "next_assessment_due": "2026-10-23T10:00:00.000Z",
  "source": {
    "instrument": "Cognitive Delivery Index",
    "version": "1.0"
  }
}
